[
  {
    "id": "applicableMinimumWage",
    "label": "Applicable minimum hourly wage",
    "type": "money",
    "whyWeAsk": "This is the minimum hourly wage that applies to this situation."
  },
  {
    "id": "estimatedEstateValue",
    "label": "Character and estimated value of estate property",
    "type": "money",
    "whyWeAsk": "This is the approximate total value of the property in the estate."
  },
  {
    "id": "monthlyRent",
    "label": "Monthly rent",
    "type": "money",
    "whyWeAsk": "This is the monthly rent amount for the property described in this document."
  },
  {
    "id": "purchasePrice",
    "label": "Purchase price",
    "type": "money",
    "whyWeAsk": "This is the price being paid for the property or asset described in this document."
  },
  {
    "id": "salary",
    "label": "Starting base salary",
    "type": "money",
    "whyWeAsk": "This is the salary amount described in this document."
  },
  {
    "id": "unpaidWagesAmount",
    "label": "Unpaid wages amount",
    "type": "money",
    "whyWeAsk": "This is the amount of wages that have not been paid."
  }
]
