[
  {
    "id": "agreementDate",
    "label": "Date of this agreement",
    "type": "date",
    "whyWeAsk": "This is the date the parties are entering into this agreement."
  },
  {
    "id": "childDOB",
    "label": "Child's date of birth",
    "type": "date",
    "whyWeAsk": "This is the child's date of birth."
  },
  {
    "id": "closingDate",
    "label": "Closing date",
    "type": "date",
    "whyWeAsk": "This is the date the transaction described in this document is expected to close."
  },
  {
    "id": "dateOfDeath",
    "label": "Date of death",
    "type": "date",
    "whyWeAsk": "This is the date the decedent died."
  },
  {
    "id": "dateSigned",
    "label": "Date signed",
    "type": "date",
    "whyWeAsk": "This is the date this document is signed."
  },
  {
    "id": "demandDate",
    "label": "Response deadline",
    "type": "date",
    "whyWeAsk": "This is the date the demand described in this document is being made."
  },
  {
    "id": "determinationDate",
    "label": "Date of the EDD determination",
    "type": "date",
    "whyWeAsk": "This is the date a decision or determination described in this document was made."
  },
  {
    "id": "dissolutionDate",
    "label": "Dissolution date",
    "type": "date",
    "whyWeAsk": "This is the date the dissolution described in this document took effect or is expected to take effect."
  },
  {
    "id": "effectiveDate",
    "label": "Effective date",
    "type": "date",
    "whyWeAsk": "This is the date this document's terms begin to apply."
  },
  {
    "id": "endDate",
    "label": "Internship end date",
    "type": "date",
    "whyWeAsk": "This is the date the period or arrangement described in this document ends."
  },
  {
    "id": "filingDate",
    "label": "Filing date",
    "type": "date",
    "whyWeAsk": "This is the date this document is being filed."
  },
  {
    "id": "firstUseDate",
    "label": "Date of first use in commerce (if applicable)",
    "type": "date",
    "whyWeAsk": "This is the date the trademark or work described in this document was first used."
  },
  {
    "id": "incidentDate",
    "label": "Date of incident",
    "type": "date",
    "whyWeAsk": "This is the date the incident described in this document occurred."
  },
  {
    "id": "leaseEndDate",
    "label": "Lease end date",
    "type": "date",
    "whyWeAsk": "This is the date the lease described in this document ends."
  },
  {
    "id": "leaseStartDate",
    "label": "Lease start date",
    "type": "date",
    "whyWeAsk": "This is the date the lease described in this document begins."
  },
  {
    "id": "marriageDate",
    "label": "Date of marriage",
    "type": "date",
    "whyWeAsk": "This is the date of the marriage this document concerns."
  },
  {
    "id": "moveOutDate",
    "label": "Move-out date (date tenant vacated)",
    "type": "date",
    "whyWeAsk": "This is the date the tenant is expected to move out."
  },
  {
    "id": "noticeDate",
    "label": "Date of this notice",
    "type": "date",
    "whyWeAsk": "This is the date this notice is being given."
  },
  {
    "id": "originalTrustDate",
    "label": "Date the original trust was created",
    "type": "date",
    "whyWeAsk": "This is the date the trust was originally created."
  },
  {
    "id": "qualifyingEventDate",
    "label": "Date of the qualifying event",
    "type": "date",
    "whyWeAsk": "This is the date the qualifying event described in this document occurred."
  },
  {
    "id": "requestDate",
    "label": "Date of this request",
    "type": "date",
    "whyWeAsk": "This is the date the request described in this document is being made."
  },
  {
    "id": "separationDate",
    "label": "Date of separation",
    "type": "date",
    "whyWeAsk": "This is the date employment ended."
  },
  {
    "id": "serviceEndDate",
    "label": "Service end date (if known)",
    "type": "date",
    "whyWeAsk": "This is the date the period of service described in this document ends."
  },
  {
    "id": "serviceStartDate",
    "label": "Service start date",
    "type": "date",
    "whyWeAsk": "This is the date the period of service described in this document begins."
  },
  {
    "id": "signatureDate",
    "label": "Signature date",
    "type": "date",
    "whyWeAsk": "This is the date this document is signed."
  },
  {
    "id": "startDate",
    "label": "Start date",
    "type": "date",
    "whyWeAsk": "This is the date the arrangement described in this document begins."
  },
  {
    "id": "terminationDate",
    "label": "Termination date",
    "type": "date",
    "whyWeAsk": "This is the date employment or the agreement described in this document ends."
  }
]
