[
  {
    "id": "county",
    "label": "County",
    "type": "county",
    "whyWeAsk": "This is the California county this document applies to or where it will be filed."
  },
  {
    "id": "countyName",
    "label": "County whose superior court has jurisdiction over the trust",
    "type": "county",
    "whyWeAsk": "This is the California county this document applies to."
  },
  {
    "id": "countyOfFiling",
    "label": "County of filing",
    "type": "county",
    "whyWeAsk": "This is the county where this document will be filed."
  },
  {
    "id": "issuingState",
    "label": "Issuing state",
    "type": "state",
    "whyWeAsk": "This is the state that issued the document or license this document refers to."
  },
  {
    "id": "recordingCounty",
    "label": "County for recording",
    "type": "county",
    "whyWeAsk": "This is the county where this document will be recorded."
  },
  {
    "id": "settlorCounty",
    "label": "Settlor's county of residence",
    "type": "county",
    "whyWeAsk": "This is the county where the person who created the trust lives."
  },
  {
    "id": "stateOfFormation",
    "label": "State of formation",
    "type": "state",
    "whyWeAsk": "This is the state where the entity described in this document was formed."
  },
  {
    "id": "testatorCounty",
    "label": "County of residence",
    "type": "county",
    "whyWeAsk": "This is the county where the person making the will lives."
  }
]
