[
  {
    "id": "businessName",
    "label": "Business name",
    "type": "entity-name",
    "whyWeAsk": "This is the legal name of the business this document concerns."
  },
  {
    "id": "companyName",
    "label": "Company name",
    "type": "entity-name",
    "whyWeAsk": "This is the legal name of the company this document concerns."
  },
  {
    "id": "entityName",
    "label": "Corporation or LLC name",
    "type": "entity-name",
    "whyWeAsk": "This is the legal name of the entity this document concerns."
  },
  {
    "id": "financialInstitutionName",
    "label": "Financial institution's name",
    "type": "entity-name",
    "whyWeAsk": "This is the name of the bank or financial institution this document refers to."
  },
  {
    "id": "hoaName",
    "label": "HOA / association name",
    "type": "entity-name",
    "whyWeAsk": "This is the name of the homeowners association this document concerns."
  },
  {
    "id": "insurerName",
    "label": "Insurer's name",
    "type": "entity-name",
    "whyWeAsk": "This is the name of the insurance company this document refers to."
  },
  {
    "id": "partnershipName",
    "label": "Limited partnership's name",
    "type": "entity-name",
    "whyWeAsk": "This is the legal name of the partnership this document concerns."
  },
  {
    "id": "planName",
    "label": "Group health plan name",
    "type": "entity-name",
    "whyWeAsk": "This is the name of the plan this document describes."
  },
  {
    "id": "publicEntityName",
    "label": "Public entity involved",
    "type": "entity-name",
    "whyWeAsk": "This is the name of the government or public entity this document concerns."
  },
  {
    "id": "sellerAgentName",
    "label": "Seller's agent name, if any",
    "type": "entity-name",
    "whyWeAsk": "This is the name of the real estate agent representing the seller."
  },
  {
    "id": "serviceProviderName",
    "label": "Service provider name",
    "type": "entity-name",
    "whyWeAsk": "This is the name of the business or person providing the service described in this document."
  },
  {
    "id": "trustName",
    "label": "Name of this trust",
    "type": "entity-name",
    "whyWeAsk": "This is the name of the trust this document concerns."
  }
]
