[
  {
    "id": "additionalIncidents",
    "label": "Additional incidents (if any)",
    "type": "text",
    "whyWeAsk": "This describes any other incidents relevant to this document, beyond the main one already described."
  },
  {
    "id": "additionalPurposeDescription",
    "label": "Additional purpose description (optional)",
    "type": "longtext",
    "whyWeAsk": "This describes any additional purpose for this document, beyond what's already stated."
  },
  {
    "id": "affectedEmployeeCount",
    "label": "Number of affected employees",
    "type": "integer",
    "whyWeAsk": "This is the number of employees affected by what this document describes."
  },
  {
    "id": "allegedProtectedActivity",
    "label": "Activity or report believed to be legally protected",
    "type": "longtext",
    "whyWeAsk": "This describes the protected activity the employee says they engaged in."
  },
  {
    "id": "authorizedShares",
    "label": "Total authorized shares",
    "type": "text",
    "whyWeAsk": "This is the number of shares the corporation is authorized to issue."
  },
  {
    "id": "authorizedSignerTitle",
    "label": "Authorized signer's title",
    "type": "text",
    "whyWeAsk": "This is the title or position of the person authorized to sign on behalf of the company, trust, or other entity."
  },
  {
    "id": "businessActivityDescription",
    "label": "Principal business activity",
    "type": "longtext",
    "whyWeAsk": "This describes what the business does."
  },
  {
    "id": "categoriesCollected",
    "label": "Categories of personal information collected",
    "type": "text",
    "whyWeAsk": "This describes the categories of information collected, as this document requires."
  },
  {
    "id": "cityOfExecution",
    "label": "City where signed",
    "type": "text",
    "whyWeAsk": "This is the city where this document is being signed."
  },
  {
    "id": "cityState",
    "label": "City and state signed",
    "type": "text",
    "whyWeAsk": "This is the city and state where this document is being signed."
  },
  {
    "id": "commissionStructure",
    "label": "Commission structure and rate",
    "type": "text",
    "whyWeAsk": "This describes how commission is calculated under this document."
  },
  {
    "id": "contactMethod",
    "label": "How consumers may contact the business or submit requests",
    "type": "text",
    "whyWeAsk": "This describes how the parties will contact each other under this document."
  },
  {
    "id": "courtCaseNumber",
    "label": "Court case number",
    "type": "text",
    "whyWeAsk": "This is the case number assigned by the court."
  },
  {
    "id": "dissolutionReason",
    "label": "Reason/event triggering dissolution",
    "type": "text",
    "whyWeAsk": "This describes the reason for the dissolution described in this document."
  },
  {
    "id": "educationalInstitution",
    "label": "Educational institution (if applicable)",
    "type": "text",
    "whyWeAsk": "This is the name of the school or educational institution this document refers to."
  },
  {
    "id": "employeeCount",
    "label": "Approximate Total Employee Count",
    "type": "integer",
    "whyWeAsk": "This is the number of employees this document refers to."
  },
  {
    "id": "entityType",
    "label": "Entity type",
    "type": "text",
    "whyWeAsk": "This is the type of legal entity this document concerns, such as an LLC or corporation."
  },
  {
    "id": "goodsServicesDescription",
    "label": "Goods and/or services",
    "type": "longtext",
    "whyWeAsk": "This describes the goods or services this document covers."
  },
  {
    "id": "hoursPerWeek",
    "label": "Hours per week",
    "type": "integer",
    "whyWeAsk": "This is the number of hours per week this document refers to."
  },
  {
    "id": "incidentDescription",
    "label": "Description of incident",
    "type": "longtext",
    "whyWeAsk": "This describes what happened in the incident this document concerns."
  },
  {
    "id": "incidentLocation",
    "label": "Location of incident",
    "type": "text",
    "whyWeAsk": "This is the location where the incident described in this document occurred."
  },
  {
    "id": "issuingCaseNumber",
    "label": "Issuing court's case number",
    "type": "text",
    "whyWeAsk": "This is the case number of the order or judgment this document refers to."
  },
  {
    "id": "jobTitle",
    "label": "Job title",
    "type": "text",
    "whyWeAsk": "This is the employee's job title."
  },
  {
    "id": "legalDescription",
    "label": "Legal description of the property",
    "type": "longtext",
    "whyWeAsk": "This is the formal legal description of the property, as it appears in county records."
  },
  {
    "id": "officerTitle",
    "label": "Officer's title",
    "type": "text",
    "whyWeAsk": "This is the title of the officer named in this document."
  },
  {
    "id": "ownershipPercentage",
    "label": "Approximate ownership or membership interest, if known",
    "type": "percent",
    "whyWeAsk": "This is the percentage of ownership this document refers to."
  },
  {
    "id": "parcelNumber",
    "label": "Assessor's Parcel Number",
    "type": "text",
    "whyWeAsk": "This is the county assessor's parcel number for the property."
  },
  {
    "id": "patentDescription",
    "label": "Description of the patent or invention",
    "type": "longtext",
    "whyWeAsk": "This describes the invention or patent this document concerns."
  },
  {
    "id": "policyNumber",
    "label": "Policy number",
    "type": "text",
    "whyWeAsk": "This is the policy number this document refers to."
  },
  {
    "id": "positionTitle",
    "label": "Position held at separation",
    "type": "text",
    "whyWeAsk": "This is the job title or position this document refers to."
  },
  {
    "id": "professionType",
    "label": "Licensed profession",
    "type": "text",
    "whyWeAsk": "This is the profession or occupation this document refers to."
  },
  {
    "id": "propertyDescription",
    "label": "Description of property sought",
    "type": "longtext",
    "whyWeAsk": "This describes the property this document concerns."
  },
  {
    "id": "relationshipToChild",
    "label": "Proposed guardian's relationship to the child",
    "type": "text",
    "whyWeAsk": "This describes how this person is related to the child."
  },
  {
    "id": "relationshipToDecedent",
    "label": "Relationship to decedent",
    "type": "text",
    "whyWeAsk": "This describes how this person is related to the person who died."
  },
  {
    "id": "restrictionPeriod",
    "label": "Restriction period",
    "type": "text",
    "whyWeAsk": "This is the length of time the restriction described in this document lasts."
  },
  {
    "id": "signatureCity",
    "label": "City where signed",
    "type": "text",
    "whyWeAsk": "This is the city where this document is being signed."
  },
  {
    "id": "tradeSecretDescription",
    "label": "Description of the trade secret",
    "type": "longtext",
    "whyWeAsk": "This describes the trade secret this document concerns."
  },
  {
    "id": "trademarkDescription",
    "label": "Description of the trademark",
    "type": "longtext",
    "whyWeAsk": "This describes the trademark this document concerns."
  },
  {
    "id": "transactionDescription",
    "label": "Transaction or conduct at issue, if applicable",
    "type": "longtext",
    "whyWeAsk": "This describes the transaction this document concerns."
  },
  {
    "id": "wageClaimBasis",
    "label": "What the claimed wages are for",
    "type": "longtext",
    "whyWeAsk": "This describes the basis for the wage claim described in this document."
  },
  {
    "id": "websiteURL",
    "label": "Website or online service URL",
    "type": "text",
    "whyWeAsk": "This is the web address this document refers to."
  },
  {
    "id": "workDescription",
    "label": "Description of the work",
    "type": "longtext",
    "whyWeAsk": "This describes the work this document concerns."
  },
  {
    "id": "workTitle",
    "label": "Title of the work",
    "type": "text",
    "whyWeAsk": "This is the title of the work this document concerns."
  }
]
